{
  "$schema": "https://json-schema.org/draft/2020-12/schema",
  "$id": "https://example.local/maestro/evidence.schema.json",
  "title": "Maestro evidence item",
  "type": "object",
  "additionalProperties": false,
  "required": [
    "schema_version",
    "evidence_id",
    "work_id",
    "evidence_type",
    "summary",
    "created_by",
    "created_at",
    "redacted"
  ],
  "properties": {
    "schema_version": {
      "type": "integer",
      "const": 1
    },
    "evidence_id": {
      "type": "string",
      "minLength": 1
    },
    "work_id": {
      "type": "string",
      "minLength": 1
    },
    "packet_id": {
      "type": [
        "string",
        "null"
      ]
    },
    "handoff_id": {
      "type": [
        "string",
        "null"
      ]
    },
    "evidence_type": {
      "type": "string",
      "enum": [
        "command",
        "test",
        "browser",
        "ci",
        "review",
        "diff",
        "file",
        "approval",
        "release",
        "migration",
        "security",
        "manual",
        "other"
      ]
    },
    "summary": {
      "type": "string",
      "minLength": 1
    },
    "source": {
      "type": "object",
      "additionalProperties": false,
      "properties": {
        "path": {
          "type": [
            "string",
            "null"
          ]
        },
        "uri": {
          "type": [
            "string",
            "null"
          ]
        },
        "commit": {
          "type": [
            "string",
            "null"
          ]
        },
        "artifact_ref": {
          "type": [
            "string",
            "null"
          ]
        },
        "content_hash": {
          "type": [
            "string",
            "null"
          ]
        }
      }
    },
    "command": {
      "type": "object",
      "additionalProperties": false,
      "properties": {
        "command": {
          "type": "string"
        },
        "cwd": {
          "type": "string"
        },
        "exit_code": {
          "type": [
            "integer",
            "null"
          ]
        },
        "duration_seconds": {
          "type": [
            "number",
            "null"
          ]
        },
        "outcome": {
          "type": "string",
          "enum": [
            "passed",
            "failed",
            "skipped",
            "blocked",
            "not_run"
          ]
        }
      }
    },
    "metadata": {
      "description": "Optional scalar metadata for filtering and compact context. Do not store raw logs, screenshots, secrets, or nested payloads here; use source.artifact_ref or another evidence item instead.",
      "type": "object",
      "additionalProperties": {
        "type": [
          "string",
          "number",
          "integer",
          "boolean",
          "null"
        ]
      }
    },
    "created_by": {
      "type": "string",
      "enum": [
        "maestro",
        "charlie",
        "grant",
        "mason",
        "scout",
        "lens",
        "release",
        "scribe",
        "archivist",
        "owner",
        "ci"
      ]
    },
    "created_at": {
      "type": "string"
    },
    "redacted": {
      "type": "boolean"
    },
    "redaction_notes": {
      "type": "string"
    }
  }
}
